{
  "schemaVersion": 1,
  "provider": "drand",
  "apiVersion": "v2",
  "chainHash": "52db9ba70e0cc0f6eaf7803dd07447a1f5477735fd3f661792ba94600c84e971",
  "seed": "7010277ecb91976aba93d63d298503889de63e291a5a49f7c1b8d2cce2b3e858",
  "round": 33382601,
  "buttonPressedAt": "2026-10-25T18:00:00.000Z",
  "requestStartedAt": "2026-10-25T18:00:00.100Z",
  "responseReceivedAt": "2026-10-25T18:00:00.300Z",
  "roundScheduledTimeUtc": "2026-10-25T17:59:27.000Z",
  "signatureVerified": true
}
